[
  { "id": "EVT-DEMO-001", "projectId": "PRJ-METRO-001", "reporterId": "USR-SUP-001", "observedAt": "2026-09-26T04:30:00Z", "receivedAt": "2026-09-26T04:31:00Z", "evidence": { "text": "Fixed 3 tonnes of rebar at Pier P12, chainage 12+410 to 12+425.", "attachmentIds": ["ATT-DEMO-001"] }, "extractedFacts": { "assetId": "PIER-P12", "discipline": "structural", "workType": "rebar-fixing", "location": { "kind": "chainage", "alignment": "BL", "start": 12410, "end": 12425, "unit": "m" }, "quantity": { "value": 3, "unit": "t" }, "keywords": ["pier", "rebar", "fixed"] }, "status": "submitted" },
  { "id": "EVT-DEMO-002", "projectId": "PRJ-METRO-001", "reporterId": "USR-SUP-001", "observedAt": "2026-09-26T05:00:00Z", "receivedAt": "2026-09-26T05:02:00Z", "evidence": { "text": "Crew working at P12; preparation continuing.", "attachmentIds": [] }, "extractedFacts": { "assetId": "PIER-P12", "discipline": "structural", "location": { "kind": "chainage", "alignment": "BL", "start": 12405, "end": 12420, "unit": "m" }, "keywords": ["crew", "preparation"] }, "status": "submitted" },
  { "id": "EVT-DEMO-003", "projectId": "PRJ-METRO-001", "reporterId": "USR-SUP-001", "observedAt": "2026-09-26T05:30:00Z", "receivedAt": "2026-09-26T05:31:00Z", "evidence": { "text": "Drain cleaning near depot entrance.", "attachmentIds": [] }, "extractedFacts": { "discipline": "civil", "workType": "drain-cleaning", "keywords": ["drain", "cleaning", "depot"] }, "status": "submitted" }
]
